{
  "version": "1.1",
  "description": "Shared canonical LLMesh compressed header, multi-LOD pixel selection, and submesh material partition test vectors",
  "llmesh_vectors": [
    {
      "name": "canonical_triangle_llmesh",
      "hex_bytes": "4c696e64656e2042696e617279204d65736820312e3000000000000000000000000000000000000000000000000000000000000000803f0000803f0000803f03000000000000000000000000000000803f0000000000000000000000000000803f00000000000000000000803f00000000000000000000803f0000803f00000000000000000000803f00000000000000000000803f000000000000000000000000000000000000803f00000000000000000000803f0100000001000200456e64204d6f72706873000000000000000000000000000000000000000000000000000000000000000000000000000000000000000000000000000000000000",
      "expected": {
        "vertex_count": 3,
        "index_count": 3,
        "positions": [0.0, 0.0, 0.0, 1.0, 0.0, 0.0, 0.0, 1.0, 0.0],
        "normals": [0.0, 0.0, 1.0, 0.0, 0.0, 1.0, 0.0, 0.0, 1.0],
        "uvs": [0.0, 0.0, 1.0, 0.0, 0.0, 1.0],
        "indices": [0, 1, 2]
      }
    }
  ],
  "multi_lod_vectors": [
    {
      "name": "high_lod_close_up",
      "bounding_radius": 1.0,
      "distance_meters": 5.0,
      "fov_rad": 1.0471975512,
      "screen_height_px": 1080.0,
      "expected": {
        "projected_pixel_coverage": 374.1229,
        "selected_lod": "high_lod"
      }
    },
    {
      "name": "medium_lod_mid_range",
      "bounding_radius": 1.0,
      "distance_meters": 15.0,
      "fov_rad": 1.0471975512,
      "screen_height_px": 1080.0,
      "expected": {
        "projected_pixel_coverage": 124.7076,
        "selected_lod": "medium_lod"
      }
    },
    {
      "name": "low_lod_far_range",
      "bounding_radius": 1.0,
      "distance_meters": 50.0,
      "fov_rad": 1.0471975512,
      "screen_height_px": 1080.0,
      "expected": {
        "projected_pixel_coverage": 37.4123,
        "selected_lod": "low_lod"
      }
    },
    {
      "name": "lowest_lod_extreme_range",
      "bounding_radius": 1.0,
      "distance_meters": 200.0,
      "fov_rad": 1.0471975512,
      "screen_height_px": 1080.0,
      "expected": {
        "projected_pixel_coverage": 9.3531,
        "selected_lod": "lowest_lod"
      }
    }
  ],
  "submesh_vectors": [
    {
      "name": "canonical_single_submesh",
      "hex_bytes": "4c696e64656e2042696e617279204d65736820312e3000000000000000000000000000000000000000000000000000000000000000803f0000803f0000803f03000000000000000000000000000000803f0000000000000000000000000000803f00000000000000000000803f00000000000000000000803f0000803f00000000000000000000803f00000000000000000000803f000000000000000000000000000000000000803f00000000000000000000803f0100000001000200456e64204d6f72706873000000000000000000000000000000000000000000000000000000000000000000000000000000000000000000000000000000000000",
      "expected": {
        "submesh_count": 1,
        "submeshes": [
          {
            "material_index": 0,
            "vertex_count": 3,
            "index_count": 3
          }
        ]
      }
    },
    {
      "name": "canonical_multi_submesh",
      "hex_bytes": "4c696e64656e2042696e617279204d65736820312e3000000000000000000000000000000000000000000000000000000000000000803f0000803f0000803f03000000000000000000000000000000803f0000000000000000000000000000803f00000000000000000000803f00000000000000000000803f0000803f00000000000000000000803f00000000000000000000803f000000000000000000000000000000000000803f00000000000000000000803f0100000001000200456e64204d6f7270687300000000000000000000000000000000000000000000000000000000000000000000000000000000000000000000000000000000000002000000000003000000030001000000030000000300",
      "expected": {
        "submesh_count": 2,
        "submeshes": [
          {
            "material_index": 0,
            "vertex_count": 3,
            "index_count": 3
          },
          {
            "material_index": 1,
            "vertex_count": 3,
            "index_count": 3
          }
        ]
      }
    }
  ]
}
